{
  "meta": {
    "schemaVersion": "1.0.0",
    "datasetVersion": "2026.04.02",
    "year": 2026,
    "timezone": "America/Sao_Paulo",
    "source": "Consolidação validada do calendário 2026 estruturado anteriormente.",
    "sourceDocuments": [
      "dados-calendario-2026.json"
    ],
    "createdAt": "2026-04-02T12:00:00Z",
    "updatedAt": "2026-04-02T12:00:00Z",
    "totalEventos": 13
  },
  "eventos": [
    {
      "id": 1,
      "slug": "sao-sebastiao-2026-01-20",
      "title": "São Sebastião",
      "date": "2026-01-20",
      "dayOfWeek": "Terça-feira",
      "startTime": "09:00",
      "endTime": "18:00",
      "timezone": "America/Sao_Paulo",
      "description": "Dia dedicado a São Sebastião, protetor contra as epidemias. Data importante no calendário espírita.",
      "eventType": 3,
      "location": "Casa de Caridade Batuara",
      "participants": [
        "Assistência",
        "Médiuns",
        "Cambonos"
      ],
      "expectedParticipants": 90,
      "status": "scheduled",
      "holidayType": "religious",
      "recurrence": null,
      "createdAt": "2026-04-02T12:00:00Z",
      "updatedAt": "2026-04-02T12:00:00Z"
    },
    {
      "id": 2,
      "slug": "dia-de-oxossi-2026-01-20",
      "title": "Dia de Oxóssi",
      "date": "2026-01-20",
      "dayOfWeek": "Terça-feira",
      "startTime": "19:00",
      "endTime": "22:00",
      "timezone": "America/Sao_Paulo",
      "description": "Celebração do dia de Oxóssi, Orixá da mata, da fartura e do conhecimento. Gira especial com ofertas de caça e beers.",
      "eventType": 1,
      "location": "Casa de Caridade Batuara",
      "participants": [
        "Assistência",
        "Médiuns",
        "Cambonos",
        "Filhos do Orixá homenageado"
      ],
      "expectedParticipants": 180,
      "status": "scheduled",
      "holidayType": null,
      "recurrence": null,
      "createdAt": "2026-04-02T12:00:00Z",
      "updatedAt": "2026-04-02T12:00:00Z"
    },
    {
      "id": 3,
      "slug": "dia-de-iemanja-natal-de-iemanja-2026-02-02",
      "title": "Dia de Iemanjá (潮) / Natal de Iemanjá",
      "date": "2026-02-02",
      "dayOfWeek": "Segunda-feira",
      "startTime": "19:00",
      "endTime": "23:00",
      "timezone": "America/Sao_Paulo",
      "description": "Dia de Iemanjá (潮): Celebração do dia de Iemanjá, mãe de todos os Orixás. Cerimônia especial com gira de água.\n\nNatal de Iemanjá: Celebração do 'Natal' de Iemanjá. Uma das datas mais importantes para os seguidores de Umbanda e Candomblé.",
      "eventType": 1,
      "location": "Casa de Caridade Batuara",
      "participants": [
        "Assistência",
        "Cambonos",
        "Filhos do Orixá homenageado",
        "Médiuns"
      ],
      "expectedParticipants": 180,
      "status": "scheduled",
      "holidayType": null,
      "recurrence": null,
      "createdAt": "2026-04-02T12:00:00Z",
      "updatedAt": "2026-04-02T12:00:00Z"
    },
    {
      "id": 4,
      "slug": "aniversario-de-iemanja-2026-04-23",
      "title": "Aniversário de Iemanjá",
      "date": "2026-04-23",
      "dayOfWeek": "Quinta-feira",
      "startTime": "19:00",
      "endTime": "23:00",
      "timezone": "America/Sao_Paulo",
      "description": "Comemoração do aniversário de Iemanjá, mãe querida de todos os filhos. Gira especial com oferendas ao mar.",
      "eventType": 1,
      "location": "Casa de Caridade Batuara",
      "participants": [
        "Assistência",
        "Médiuns",
        "Cambonos",
        "Filhos do Orixá homenageado"
      ],
      "expectedParticipants": 180,
      "status": "scheduled",
      "holidayType": null,
      "recurrence": null,
      "createdAt": "2026-04-02T12:00:00Z",
      "updatedAt": "2026-04-02T12:00:00Z"
    },
    {
      "id": 5,
      "slug": "dia-de-todos-os-santos-2026-05-01",
      "title": "Dia de Todos os Santos",
      "date": "2026-05-01",
      "dayOfWeek": "Sexta-feira",
      "startTime": "09:00",
      "endTime": "18:00",
      "timezone": "America/Sao_Paulo",
      "description": "Celebração do Dia de Todos os Santos. Feriado religioso que coincide com a Linha de Oxalá.",
      "eventType": 3,
      "location": "Casa de Caridade Batuara",
      "participants": [
        "Assistência",
        "Médiuns",
        "Cambonos"
      ],
      "expectedParticipants": 90,
      "status": "scheduled",
      "holidayType": null,
      "recurrence": null,
      "createdAt": "2026-04-02T12:00:00Z",
      "updatedAt": "2026-04-02T12:00:00Z"
    },
    {
      "id": 6,
      "slug": "dia-do-trabalho-2026-05-01",
      "title": "Dia do Trabalho",
      "date": "2026-05-01",
      "dayOfWeek": "Sexta-feira",
      "startTime": null,
      "endTime": null,
      "timezone": "America/Sao_Paulo",
      "description": "Feriado nacional. Casa fechada para atendimento espiritual.",
      "eventType": 3,
      "location": "Casa fechada",
      "participants": [
        "Casa fechada"
      ],
      "expectedParticipants": 0,
      "status": "cancelled",
      "holidayType": "national",
      "recurrence": null,
      "createdAt": "2026-04-02T12:00:00Z",
      "updatedAt": "2026-04-02T12:00:00Z"
    },
    {
      "id": 7,
      "slug": "festa-junina-de-sao-joao-2026-06-24",
      "title": "Festa Junina de São João",
      "date": "2026-06-24",
      "dayOfWeek": "Quarta-feira",
      "startTime": "19:00",
      "endTime": "23:00",
      "timezone": "America/Sao_Paulo",
      "description": "Celebração de São João com bingo, quadrilha, comidas típicas e muito forró. Momento de fraternidade e alegria.",
      "eventType": 1,
      "location": "Casa de Caridade Batuara",
      "participants": [
        "Assistência",
        "Médiuns",
        "Cambonos"
      ],
      "expectedParticipants": 180,
      "status": "scheduled",
      "holidayType": null,
      "recurrence": null,
      "createdAt": "2026-04-02T12:00:00Z",
      "updatedAt": "2026-04-02T12:00:00Z"
    },
    {
      "id": 8,
      "slug": "dia-de-ogum-2026-07-27",
      "title": "Dia de Ogum",
      "date": "2026-07-27",
      "dayOfWeek": "Segunda-feira",
      "startTime": "19:00",
      "endTime": "22:00",
      "timezone": "America/Sao_Paulo",
      "description": "Celebração do dia de Ogum, Orixá guerreiro, senhor do ferro e das estradas. Gira especial com ofertas de ferro.",
      "eventType": 1,
      "location": "Casa de Caridade Batuara",
      "participants": [
        "Assistência",
        "Médiuns",
        "Cambonos",
        "Filhos do Orixá homenageado"
      ],
      "expectedParticipants": 180,
      "status": "scheduled",
      "holidayType": null,
      "recurrence": null,
      "createdAt": "2026-04-02T12:00:00Z",
      "updatedAt": "2026-04-02T12:00:00Z"
    },
    {
      "id": 9,
      "slug": "dia-de-nana-2026-08-15",
      "title": "Dia de Nanã",
      "date": "2026-08-15",
      "dayOfWeek": "Sábado",
      "startTime": "19:00",
      "endTime": "22:00",
      "timezone": "America/Sao_Paulo",
      "description": "Celebração do dia de Nanã, Orixá anciã, senhora da sabedoria e dos mistérios da vida e morte.",
      "eventType": 1,
      "location": "Casa de Caridade Batuara",
      "participants": [
        "Assistência",
        "Médiuns",
        "Cambonos"
      ],
      "expectedParticipants": 180,
      "status": "scheduled",
      "holidayType": null,
      "recurrence": null,
      "createdAt": "2026-04-02T12:00:00Z",
      "updatedAt": "2026-04-02T12:00:00Z"
    },
    {
      "id": 10,
      "slug": "dia-de-oxum-2026-08-16",
      "title": "Dia de Oxum",
      "date": "2026-08-16",
      "dayOfWeek": "Domingo",
      "startTime": "19:00",
      "endTime": "22:00",
      "timezone": "America/Sao_Paulo",
      "description": "Celebração do dia de Oxum, Orixá do amor, da beleza e das águas doces. Gira especial com oferendas douradas.",
      "eventType": 1,
      "location": "Casa de Caridade Batuara",
      "participants": [
        "Assistência",
        "Médiuns",
        "Cambonos"
      ],
      "expectedParticipants": 180,
      "status": "scheduled",
      "holidayType": null,
      "recurrence": null,
      "createdAt": "2026-04-02T12:00:00Z",
      "updatedAt": "2026-04-02T12:00:00Z"
    },
    {
      "id": 11,
      "slug": "dia-de-obaluae-2026-10-31",
      "title": "Dia de Obaluaê",
      "date": "2026-10-31",
      "dayOfWeek": "Sábado",
      "startTime": "19:00",
      "endTime": "22:00",
      "timezone": "America/Sao_Paulo",
      "description": "Celebração do dia de Obaluaê, Orixá da cura e das doenças. Gira especial com preces pela saúde.",
      "eventType": 1,
      "location": "Casa de Caridade Batuara",
      "participants": [
        "Assistência",
        "Médiuns",
        "Cambonos"
      ],
      "expectedParticipants": 180,
      "status": "scheduled",
      "holidayType": null,
      "recurrence": null,
      "createdAt": "2026-04-02T12:00:00Z",
      "updatedAt": "2026-04-02T12:00:00Z"
    },
    {
      "id": 12,
      "slug": "natal-de-iansa-natal-de-logun-ede-2026-12-08",
      "title": "Natal de Iansã / Natal de Logun Edé",
      "date": "2026-12-08",
      "dayOfWeek": "Terça-feira",
      "startTime": "19:00",
      "endTime": "22:00",
      "timezone": "America/Sao_Paulo",
      "description": "Natal de Iansã: Celebração do Natal de Iansã. Data importante para os filhos desta Orixá guerreira.\n\nNatal de Logun Edé: Celebração do Natal de Logun Edé, Orixá da união entre força e amor.",
      "eventType": 1,
      "location": "Casa de Caridade Batuara",
      "participants": [
        "Assistência",
        "Cambonos",
        "Médiuns"
      ],
      "expectedParticipants": 180,
      "status": "scheduled",
      "holidayType": null,
      "recurrence": null,
      "createdAt": "2026-04-02T12:00:00Z",
      "updatedAt": "2026-04-02T12:00:00Z"
    },
    {
      "id": 13,
      "slug": "natal-2026-12-25",
      "title": "Natal",
      "date": "2026-12-25",
      "dayOfWeek": "Sexta-feira",
      "startTime": "09:00",